{
  "$schema": "https://json-schema.org/draft/2020-12/schema",
  "title": "Claude Worker launch configuration (separate from assignment)",
  "type": "object",
  "additionalProperties": false,
  "required": [
    "schema_version",
    "native_session_id",
    "agent_id",
    "dispatcher_agent_id",
    "coordination_executable",
    "coordination_mode",
    "ledger_directory",
    "client_executable",
    "permission_mode",
    "prompt_file"
  ],
  "properties": {
    "schema_version": {
      "const": "agent-loop.claude-launch.v1"
    },
    "native_session_id": {
      "type": "string",
      "minLength": 1
    },
    "agent_id": {
      "type": "string",
      "pattern": "^[A-Za-z0-9][A-Za-z0-9_-]{0,127}$"
    },
    "dispatcher_agent_id": {
      "type": "string",
      "pattern": "^[A-Za-z0-9][A-Za-z0-9_-]{0,127}$"
    },
    "coordination_executable": {
      "type": "string",
      "pattern": "^/"
    },
    "coordination_mode": {
      "enum": [
        "native",
        "codex-wrapper-compat"
      ]
    },
    "ledger_directory": {
      "type": "string",
      "pattern": "^/"
    },
    "client_executable": {
      "type": "string",
      "pattern": "^/"
    },
    "permission_mode": {
      "enum": [
        "auto",
        "acceptEdits",
        "bypassPermissions",
        "manual",
        "dontAsk",
        "plan"
      ]
    },
    "event_executable": {
      "type": "string",
      "pattern": "^/"
    },
    "prompt_file": {
      "type": "string",
      "pattern": "^/"
    },
    "resource_overrides": {
      "type": "object",
      "additionalProperties": false,
      "properties": {
        "staging": {
          "type": "object",
          "additionalProperties": false,
          "required": [
            "item",
            "admission_reference"
          ],
          "properties": {
            "item": {
              "type": "string",
              "pattern": "^ENV-[0-9]+$"
            },
            "admission_reference": {
              "type": "string",
              "minLength": 1
            }
          }
        },
        "production": {
          "type": "object",
          "additionalProperties": false,
          "required": [
            "item",
            "admission_reference"
          ],
          "properties": {
            "item": {
              "type": "string",
              "pattern": "^ENV-[0-9]+$"
            },
            "admission_reference": {
              "type": "string",
              "minLength": 1
            }
          }
        }
      }
    },
    "delivery_readiness_file": {
      "type": "string",
      "pattern": "^/"
    },
    "human_authorization": {
      "type": "object",
      "additionalProperties": false,
      "required": [
        "assignment_id",
        "repository",
        "reference",
        "operations",
        "managed_review"
      ],
      "properties": {
        "assignment_id": {
          "type": "string",
          "minLength": 1
        },
        "repository": {
          "type": "string",
          "pattern": "^[A-Za-z0-9_-]+/[A-Za-z0-9_.-]+$"
        },
        "reference": {
          "type": "string",
          "pattern": "^[A-Za-z0-9:/#_.-]{1,200}$"
        },
        "operations": {
          "type": "array",
          "items": {
            "enum": [
              "source",
              "test",
              "pull_request",
              "managed_review",
              "gated_merge",
              "issue_close"
            ]
          }
        },
        "managed_review": {
          "type": "object",
          "additionalProperties": false,
          "required": [
            "provider",
            "destination",
            "content"
          ],
          "properties": {
            "provider": {
              "enum": [
                "grok",
                "claude",
                "codex",
                "muse"
              ]
            },
            "destination": {
              "type": "string",
              "pattern": "^[A-Za-z0-9:/#_.-]{1,200}$"
            },
            "content": {
              "const": "source_diff_and_issue_contract_only"
            }
          }
        }
      }
    },
    "model": {
      "type": "string",
      "minLength": 1
    },
    "effort": {
      "enum": [
        "low",
        "medium",
        "high",
        "xhigh",
        "max"
      ]
    }
  }
}
